{
  "$schema": "https://json-schema.org/draft/2020-12/schema",
  "title": "Experimental Pocket application package build manifest",
  "description": "Container codec only. Does not certify Runtime integration, signature authenticity or physical hardware. The canonical loader also rejects duplicate JSON keys and non-integer numeric tokens.",
  "type": "object",
  "additionalProperties": false,
  "required": ["format_version", "runtime_api", "sdk_api", "targets", "capabilities", "app_id", "app_version", "budgets", "authentication"],
  "properties": {
    "format_version": {"type": "integer", "const": 1},
    "runtime_api": {
      "type": "object", "additionalProperties": false, "required": ["min", "max"],
      "properties": {
        "min": {"type": "integer", "minimum": 1, "maximum": 4294967295},
        "max": {"type": "integer", "minimum": 1, "maximum": 4294967295}
      },
      "description": "The validator additionally requires min <= max; the loading Runtime API must lie in the inclusive range."
    },
    "sdk_api": {"type": "integer", "minimum": 1, "maximum": 4294967295},
    "targets": {"type": "array", "minItems": 1, "maxItems": 2, "uniqueItems": true,
      "items": {"enum": ["imx6ul-1024x600", "imx6ul-1024x800"]}},
    "capabilities": {"type": "array", "minItems": 1, "maxItems": 8, "uniqueItems": true,
      "items": {"enum": ["ui.core", "ui.keyboard.ascii", "ui.images", "ui.ime.pinyin", "ipc.query", "ipc.command", "ipc.events", "ipc.state"]},
      "contains": {"const": "ui.core"}},
    "app_id": {"type": "string", "maxLength": 63, "pattern": "^[a-z][a-z0-9.-]*$"},
    "app_version": {"type": "string", "maxLength": 31, "pattern": "^(0|[1-9][0-9]*)\\.(0|[1-9][0-9]*)\\.(0|[1-9][0-9]*)$"},
    "budgets": {
      "type": "object", "additionalProperties": false, "required": ["heap_bytes", "asset_bytes"],
      "properties": {
        "heap_bytes": {"type": "integer", "minimum": 1048576, "maximum": 8388608},
        "asset_bytes": {"type": "integer", "minimum": 1, "maximum": 16777216}
      },
      "description": "heap_bytes is the requested application-VM heap, NOT total UI RSS. asset_bytes includes every member byte, including source/catalog/notices. The whole container is independently capped at 16 MiB."
    },
    "authentication": {"const": "none", "description": "Unsigned containers require explicit opt-in. A digest does not authenticate a publisher."}
  }
}
