{
  "format_version": 1,
  "runtime_api": {"min": 1, "max": 1},
  "sdk_api": 1,
  "targets": ["imx6ul-1024x600", "imx6ul-1024x800"],
  "capabilities": ["ui.core", "ui.keyboard.ascii", "ui.images"],
  "app_id": "com.pocket.coffee",
  "app_version": "0.1.0",
  "budgets": {"heap_bytes": 8388608, "asset_bytes": 16777216},
  "authentication": "none"
}
